{
  "id": "v02-no-openings",
  "description": "No openings",
  "pack": "painting",
  "priceList": {
    "unitSystem": "metric",
    "markupBasisPoints": 0,
    "items": [
      {
        "code": "wall_painting",
        "name": "Wall painting",
        "kind": "labour",
        "unit": "squareMetre",
        "unitPrice": 450
      },
      {
        "code": "wall_paint",
        "name": "Wall paint",
        "kind": "material",
        "unit": "litre",
        "unitPrice": 1200,
        "coverageHundredths": 1200
      },
      {
        "code": "ceiling_painting",
        "name": "Ceiling painting",
        "kind": "labour",
        "unit": "squareMetre",
        "unitPrice": 550
      },
      {
        "code": "ceiling_paint",
        "name": "Ceiling paint",
        "kind": "material",
        "unit": "litre",
        "unitPrice": 900,
        "coverageHundredths": 1200
      },
      {
        "code": "prep_good",
        "name": "Preparation (good)",
        "kind": "labour",
        "unit": "squareMetre",
        "unitPrice": 50
      },
      {
        "code": "prep_fair",
        "name": "Preparation (fair)",
        "kind": "labour",
        "unit": "squareMetre",
        "unitPrice": 150
      },
      {
        "code": "prep_poor",
        "name": "Preparation (poor)",
        "kind": "labour",
        "unit": "squareMetre",
        "unitPrice": 300
      },
      {
        "code": "primer_application",
        "name": "Primer application",
        "kind": "labour",
        "unit": "squareMetre",
        "unitPrice": 300
      },
      {
        "code": "primer",
        "name": "Primer",
        "kind": "material",
        "unit": "litre",
        "unitPrice": 1000,
        "coverageHundredths": 1000
      }
    ]
  },
  "taxBasisPoints": 2000,
  "sections": [
    {
      "name": "Room",
      "fields": {
        "length": {
          "m": "4.00"
        },
        "width": {
          "m": "3.00"
        },
        "height": {
          "m": "2.50"
        }
      }
    }
  ],
  "expected": {
    "lines": [
      {
        "code": "wall_painting",
        "qtyHundredths": 7000,
        "unitPrice": 450,
        "total": 31500
      },
      {
        "code": "wall_paint",
        "qtyHundredths": 600,
        "unitPrice": 1200,
        "total": 7200
      },
      {
        "code": "prep_good",
        "qtyHundredths": 3500,
        "unitPrice": 50,
        "total": 1750
      }
    ],
    "subtotal": 40450,
    "tax": 8090,
    "total": 48540
  }
}
