{
  "id": "v09-extra-per-net-wall",
  "description": "Extra priced per m² of net wall",
  "pack": "painting",
  "priceList": {
    "unitSystem": "metric",
    "markupBasisPoints": 0,
    "items": [
      {
        "code": "wall_painting",
        "name": "Wall painting",
        "kind": "labour",
        "unit": "squareMetre",
        "unitPrice": 450
      },
      {
        "code": "wall_paint",
        "name": "Wall paint",
        "kind": "material",
        "unit": "litre",
        "unitPrice": 1200,
        "coverageHundredths": 1200
      },
      {
        "code": "ceiling_painting",
        "name": "Ceiling painting",
        "kind": "labour",
        "unit": "squareMetre",
        "unitPrice": 550
      },
      {
        "code": "ceiling_paint",
        "name": "Ceiling paint",
        "kind": "material",
        "unit": "litre",
        "unitPrice": 900,
        "coverageHundredths": 1200
      },
      {
        "code": "prep_good",
        "name": "Preparation (good)",
        "kind": "labour",
        "unit": "squareMetre",
        "unitPrice": 50
      },
      {
        "code": "prep_fair",
        "name": "Preparation (fair)",
        "kind": "labour",
        "unit": "squareMetre",
        "unitPrice": 150
      },
      {
        "code": "prep_poor",
        "name": "Preparation (poor)",
        "kind": "labour",
        "unit": "squareMetre",
        "unitPrice": 300
      },
      {
        "code": "primer_application",
        "name": "Primer application",
        "kind": "labour",
        "unit": "squareMetre",
        "unitPrice": 300
      },
      {
        "code": "primer",
        "name": "Primer",
        "kind": "material",
        "unit": "litre",
        "unitPrice": 1000,
        "coverageHundredths": 1000
      },
      {
        "code": "mould_treatment",
        "name": "Mould treatment",
        "kind": "labour",
        "unit": "squareMetre",
        "unitPrice": 150
      }
    ]
  },
  "taxBasisPoints": 2000,
  "sections": [
    {
      "name": "Room",
      "fields": {
        "length": {
          "m": "4.00"
        },
        "width": {
          "m": "3.00"
        },
        "height": {
          "m": "2.50"
        },
        "openings": [
          {
            "width": {
              "m": "0.9"
            },
            "height": {
              "m": "2.1"
            }
          },
          {
            "width": {
              "m": "1.2"
            },
            "height": {
              "m": "1.0"
            }
          }
        ]
      },
      "extras": [
        {
          "item": "mould_treatment",
          "quantity": "netWallArea"
        }
      ]
    }
  ],
  "expected": {
    "lines": [
      {
        "code": "wall_painting",
        "qtyHundredths": 6382,
        "unitPrice": 450,
        "total": 28719
      },
      {
        "code": "wall_paint",
        "qtyHundredths": 600,
        "unitPrice": 1200,
        "total": 7200
      },
      {
        "code": "prep_good",
        "qtyHundredths": 3191,
        "unitPrice": 50,
        "total": 1596
      },
      {
        "code": "mould_treatment",
        "qtyHundredths": 3191,
        "unitPrice": 150,
        "total": 4787
      }
    ],
    "subtotal": 42302,
    "tax": 8460,
    "total": 50762
  }
}
