{
  "id": "v04-primer-fair",
  "description": "Primer coat, fair surface",
  "pack": "painting",
  "priceList": {
    "unitSystem": "metric",
    "markupBasisPoints": 0,
    "items": [
      {
        "code": "wall_painting",
        "name": "Wall painting",
        "kind": "labour",
        "unit": "squareMetre",
        "unitPrice": 450
      },
      {
        "code": "wall_paint",
        "name": "Wall paint",
        "kind": "material",
        "unit": "litre",
        "unitPrice": 1200,
        "coverageHundredths": 1200
      },
      {
        "code": "ceiling_painting",
        "name": "Ceiling painting",
        "kind": "labour",
        "unit": "squareMetre",
        "unitPrice": 550
      },
      {
        "code": "ceiling_paint",
        "name": "Ceiling paint",
        "kind": "material",
        "unit": "litre",
        "unitPrice": 900,
        "coverageHundredths": 1200
      },
      {
        "code": "prep_good",
        "name": "Preparation (good)",
        "kind": "labour",
        "unit": "squareMetre",
        "unitPrice": 50
      },
      {
        "code": "prep_fair",
        "name": "Preparation (fair)",
        "kind": "labour",
        "unit": "squareMetre",
        "unitPrice": 150
      },
      {
        "code": "prep_poor",
        "name": "Preparation (poor)",
        "kind": "labour",
        "unit": "squareMetre",
        "unitPrice": 300
      },
      {
        "code": "primer_application",
        "name": "Primer application",
        "kind": "labour",
        "unit": "squareMetre",
        "unitPrice": 300
      },
      {
        "code": "primer",
        "name": "Primer",
        "kind": "material",
        "unit": "litre",
        "unitPrice": 1000,
        "coverageHundredths": 1000
      }
    ]
  },
  "taxBasisPoints": 2000,
  "sections": [
    {
      "name": "Room",
      "fields": {
        "length": {
          "m": "4.00"
        },
        "width": {
          "m": "3.00"
        },
        "height": {
          "m": "2.50"
        },
        "openings": [
          {
            "width": {
              "m": "0.9"
            },
            "height": {
              "m": "2.1"
            }
          },
          {
            "width": {
              "m": "1.2"
            },
            "height": {
              "m": "1.0"
            }
          }
        ],
        "primer": true,
        "surfaceCondition": "fair"
      }
    }
  ],
  "expected": {
    "lines": [
      {
        "code": "wall_painting",
        "qtyHundredths": 6382,
        "unitPrice": 450,
        "total": 28719
      },
      {
        "code": "wall_paint",
        "qtyHundredths": 600,
        "unitPrice": 1200,
        "total": 7200
      },
      {
        "code": "prep_fair",
        "qtyHundredths": 3191,
        "unitPrice": 150,
        "total": 4787
      },
      {
        "code": "primer_application",
        "qtyHundredths": 3191,
        "unitPrice": 300,
        "total": 9573
      },
      {
        "code": "primer",
        "qtyHundredths": 400,
        "unitPrice": 1000,
        "total": 4000
      }
    ],
    "subtotal": 54279,
    "tax": 10856,
    "total": 65135
  }
}
